{
  "id": "fc-demo-israel-oct-2024-response",
  "question": "[DEMO] Will Israel carry out a direct strike on Iranian territory by October 31, 2024?",
  "resolution_criteria": "Yes if credible reporting confirms Israeli forces struck targets inside Iran between October 2 and October 31, 2024.",
  "countries": [
    "israel",
    "iran"
  ],
  "topic": "military",
  "created_at": "2024-10-02T08:00:00+00:00",
  "deadline": "2024-10-31T23:59:00+00:00",
  "status": "resolved",
  "illustrative": true,
  "reference_class": {
    "description": "Struck side answers a direct strike with its own direct strike",
    "base_rate": 0.8,
    "baserate_id": "br-israel-iran-direct-strike-response"
  },
  "indicators_to_watch": [
    "late_night_cabinet",
    "airspace",
    "us_military_moves"
  ],
  "history": [
    {
      "at": "2024-10-02T08:00:00+00:00",
      "probability": 0.75,
      "rationale": "Illustrative entry written after the fact to show how scoring works.",
      "benchmark_probability": null
    }
  ],
  "resolution": {
    "outcome": true,
    "resolved_at": "2024-10-26T06:00:00+00:00",
    "source_url": "https://en.wikipedia.org/wiki/October_2024_Israeli_strikes_on_Iran"
  }
}
